{
  "caseId": "simple_square",
  "description": "Four CAD line segments forming one lot polygon.",
  "optionsProfile": "cfb_robust_v1",
  "stride": 2,
  "expectedStatus": "pass",
  "blockingForCfb": true,
  "lines": [
    { "id": 1, "family": "lot_line", "coords": [[0, 0], [10, 0]] },
    { "id": 2, "family": "lot_line", "coords": [[10, 0], [10, 10]] },
    { "id": 3, "family": "lot_line", "coords": [[10, 10], [0, 10]] },
    { "id": 4, "family": "lot_line", "coords": [[0, 10], [0, 0]] }
  ],
  "expected": {
    "polygonCount": 1,
    "totalArea": 100,
    "areaTolerance": 1e-6,
    "dangleCount": 0,
    "cutEdgeCount": 0,
    "invalidRingCount": 0,
    "boundaryLineIds": [1, 2, 3, 4]
  }
}
